Name, Region, Title, Term start, Term end, Party, Assembly, Vice(s)
Charles Robberts Swart, South Africa, State President, 1961-05-31, 1967-05-31, National Party, Parliament, —
Jozua François Naudé, South Africa, Acting State President, 1967-06-01, 1968-04-10, National Party, Parliament, —
Jim Fouché, South Africa, State President, 1968-04-10, 1975-04-09, National Party, Parliament, —
Nicolaas Diederichs, South Africa, State President, 1975-04-09, 1978-08-21, National Party, Parliament, —
B. J. Vorster, South Africa, State President, 1978-10-10, 1979-06-04, National Party, Parliament, —
Marais Viljoen, South Africa, Acting State President, 1979-06-04, 1979-09-03, National Party, Parliament, —
Marais Viljoen, South Africa, State President, 1979-09-03, 1984-09-14, National Party, Parliament, —
P. W. Botha, South Africa, State President, 1984-09-14, 1989-09-20, National Party, Parliament, —
F. W. de Klerk, South Africa, State President, 1989-09-20, 1994-05-10, National Party, Parliament, —
Nelson Mandela, South Africa, President, 1994-05-10, 1999-06-16, African National Congress, Parliament, F. W. de Klerk; Thabo Mbeki
Thabo Mbeki, South Africa, President, 1999-06-16, 2008-09-24, African National Congress, Parliament, Jacob Zuma; Phumzile Mlambo-Ngcuka
Kgalema Motlanthe, South Africa, President, 2008-09-25, 2009-05-09, African National Congress, Parliament, Baleka Mbete
Jacob Zuma, South Africa, President, 2009-05-09, 2018-02-14, African National Congress, Parliament, Kgalema Motlanthe; Cyril Ramaphosa
Cyril Ramaphosa, South Africa, President, 2018-02-15, Present, African National Congress, Parliament, David Mabuza; Paul Mashatile
Gervasio Antonio de Posadas, Argentina, Supreme Director, 31/01/1814, 09/01/1815, —, Assembly of the Year XIII, —
Carlos María de Alvear, Argentina, Supreme Director, 09/01/1815, 15/04/1815, —, Assembly of the Year XIII, —
Ignacio Álvarez Thomas, Argentina, Supreme Director, 20/04/1815, 16/04/1816, —, Congress of Tucumán, —
Juan Martín de Pueyrredón, Argentina, Supreme Director, 03/05/1816, 09/06/1819, —, Congress of Tucumán, —
José Rondeau, Argentina, Supreme Director, 1819-06-09, 1820-02-11, —, National Congress, —
Bernardino Rivadavia, Argentina, President, 1826-02-08, 1827-06-27, Unitarian, National Congress, —
Vicente López y Planes, Argentina, Interim President, 1827-07-07, 1827-08-18, —, National Congress, —
Justo José de Urquiza, Argentina, President, 1854-03-05, 1860-03-05, Federalist, National Congress, Salvador María del Carril
Santiago Derqui, Argentina, President, 1860-03-05, 1861-11-05, Federalist, National Congress, Juan Esteban Pedernera
Bartolomé Mitre, Argentina, President, 1862-10-12, 1868-10-12, National Autonomist, National Congress, Marcos Paz
Domingo Faustino Sarmiento, Argentina, President, 1868-10-12, 1874-10-12, National Autonomist, National Congress, Adolfo Alsina
Nicolás Avellaneda, Argentina, President, 1874-10-12, 1880-10-12, National Autonomist, National Congress, Mariano Acosta
Julio Argentino Roca, Argentina, President, 1880-10-12, 1886-10-12, National Autonomist, National Congress, Francisco Madero
Miguel Juárez Celman, Argentina, President, 1886-10-12, 1890-08-06, National Autonomist, National Congress, Carlos Pellegrini
Carlos Pellegrini, Argentina, President, 1890-08-06, 1892-10-12, National Autonomist, National Congress, —
Luis Sáenz Peña, Argentina, President, 1892-10-12, 1895-01-22, National Autonomist, National Congress, José Evaristo Uriburu
José Evaristo Uriburu, Argentina, President, 1895-01-23, 1898-10-12, National Autonomist, National Congress, —
Julio Argentino Roca, Argentina, President, 1898-10-12, 1904-10-12, National Autonomist, National Congress, Norberto Quirno Costa
Manuel Quintana, Argentina, President, 1904-10-12, 1906-03-12, National Autonomist, National Congress, José Figueroa Alcorta
José Figueroa Alcorta, Argentina, President, 1906-03-12, 1910-10-12, National Autonomist, National Congress, —
Roque Sáenz Peña, Argentina, President, 1910-10-12, 1914-08-09, National Autonomist, National Congress, Victorino de la Plaza
Victorino de la Plaza, Argentina, President, 1914-08-09, 1916-10-12, National Autonomist, National Congress, —
Hipólito Yrigoyen, Argentina, President, 1916-10-12, 1922-10-12, Radical Civic Union, National Congress, Pelagio Luna
Marcelo T. de Alvear, Argentina, President, 1922-10-12, 1928-10-12, Radical Civic Union, National Congress, Elpidio González
Hipólito Yrigoyen, Argentina, President, 1928-10-12, 1930-09-06, Radical Civic Union, National Congress, Enrique Martínez
José Félix Uriburu, Argentina, De facto President, 1930-09-06, 1932-02-20, Military, —, —
Agustín Pedro Justo, Argentina, President, 1932-02-20, 1938-02-20, Concordance, National Congress, Julio Argentino Roca Jr.
Roberto María Ortiz, Argentina, President, 1938-02-20, 1942-06-27, Radical Anti-Personalist, National Congress, Ramón Castillo
Ramón Castillo, Argentina, President, 1942-06-27, 1943-06-04, Conservative, National Congress, —
Pedro Pablo Ramírez, Argentina, De facto President, 1943-06-07, 1944-02-24, Military, —, —
Edelmiro Julián Farrell, Argentina, De facto President, 1944-02-24, 1946-06-04, Military, —, —
Juan Domingo Perón, Argentina, President, 1946-06-04, 1955-09-21, Peronist, National Congress, Hortensio Quijano
Eduardo Lonardi, Argentina, De facto President, 1955-09-23, 1955-11-13, Military, —, —
Pedro Eugenio Aramburu, Argentina, De facto President, 1955-11-13, 1958-05-01, Military, —, —
Arturo Frondizi, Argentina, President, 1958-05-01, 1962-03-29, UCRI, National Congress, Alejandro Gómez
José María Guido, Argentina, President, 1962-03-29, 1963-10-12, UCRI, National Congress, —
Arturo Umberto Illia, Argentina, President, 1963-10-12, 1966-06-28, Radical Civic Union, National Congress, Carlos Perette
Juan Carlos Onganía, Argentina, De facto President, 1966-06-29, 1970-06-08, Military, —, —
Roberto Marcelo Levingston, Argentina, De facto President, 1970-06-18, 23/03/1971, Military, —, —
Alejandro Agustín Lanusse, Argentina, De facto President, 26/03/1971, 25/05/1973, Military, —, —
Héctor José Cámpora, Argentina, President, 25/05/1973, 13/07/1973, Peronist, National Congress, Vicente Solano Lima
Raúl Lastiri, Argentina, Interim President, 13/07/1973, 1973-10-12, Peronist, National Congress, —
Juan Domingo Perón, Argentina, President, 1973-10-12, 1974-07-01, Peronist, National Congress, Isabel Perón
Isabel Perón, Argentina, President, 1974-07-01, 1976-03-24, Peronist, National Congress, —
Military Junta, Argentina, De facto government, 1976-03-24, 1983-12-10, Military, —, —
Raúl Alfonsín, Argentina, President, 1983-12-10, 1989-07-08, Radical Civic Union, National Congress, Víctor Martínez
Carlos Menem, Argentina, President, 1989-07-08, 1999-12-10, Justicialist, National Congress, Eduardo Duhalde / Carlos Ruckauf
Fernando de la Rúa, Argentina, President, 1999-12-10, 2001-12-20, Radical Civic Union, National Congress, Carlos Álvarez
Adolfo Rodríguez Saá, Argentina, Interim President, 2001-12-23, 2001-12-30, Justicialist, Legislative Assembly, —
Eduardo Duhalde, Argentina, Interim President, 2002-01-02, 2003-05-25, Justicialist, Legislative Assembly, —
Néstor Kirchner, Argentina, President, 2003-05-25, 2007-12-10, Justicialist, National Congress, Daniel Scioli
Cristina Fernández de Kirchner, Argentina, President, 2007-12-10, 2015-12-10, Justicialist, National Congress, Julio Cobos / Amado Boudou
Mauricio Macri, Argentina, President, 2015-12-10, 2019-12-10, PRO, National Congress, Gabriela Michetti
Alberto Fernández, Argentina, President, 2019-12-10, 2023-12-10, Justicialist, National Congress, Cristina Fernández de Kirchner
Javier Milei, Argentina, President, 2023-12-10, Present, La Libertad Avanza, National Congress, Victoria Villarruel
Sun Yat-sen, China, Provisional President (ROC), 1912-01-01, 1912-03-10, Kuomintang, National Assembly, —
Yuan Shikai, China, President (ROC), 1912-03-10, 1916-06-06, Beiyang govt, National Assembly, Li Yuanhong
Chiang Kai-shek, China (ROC), President, 1948-05-20, 1975-04-05, Kuomintang, National Assembly, Li Zongren / Yen Chia-kan
Chiang Ching-kuo, China (ROC), President, 1978-05-20, 1988-01-13, Kuomintang, National Assembly, Hsieh Tung-min / Lee Teng-hui
Lee Teng-hui, Taiwan (ROC), President, 1988-01-13, 2000-05-20, Kuomintang, National Assembly, Li Yuanzu
Chen Shui-bian, Taiwan (ROC), President, 2000-05-20, 2008-05-20, DPP, National Assembly, Annette Lu
Ma Ying-jeou, Taiwan (ROC), President, 2008-05-20, 2016-05-20, Kuomintang, National Assembly, Vincent Siew / Wu Den-yih
Tsai Ing-wen, Taiwan (ROC), President, 2016-05-20, 2024-05-20, DPP, Legislative Yuan, Chen Chien-jen / Lai Ching-te
Lai Ching-te, Taiwan (ROC), President, 2024-05-20, Present, DPP, Legislative Yuan, Hsiao Bi-khim
Mao Zedong, China (PRC), Chairman/President, 1949-10-01, 1959-04-27, CCP, National People’s Congress, Zhu De
Liu Shaoqi, China (PRC), President, 1959-04-27, 1968-10-31, CCP, National People’s Congress, Dong Biwu / Soong Ching-ling
Li Xiannian, China (PRC), President, 1983-06-18, 1988-04-08, CCP, National People’s Congress, Ulanhu
Yang Shangkun, China (PRC), President, 1988-04-08, 1993-03-27, CCP, National People’s Congress, Wang Zhen
Jiang Zemin, China (PRC), President, 1993-03-27, 2003-03-15, CCP, National People’s Congress, Rong Yiren / Hu Jintao
Hu Jintao, China (PRC), President, 2003-03-15, 2013-03-14, CCP, National People’s Congress, Zeng Qinghong / Xi Jinping
Xi Jinping, China (PRC), President, 2013-03-14, Present, CCP, National People’s Congress, Li Yuanchao / Wang Qishan / Han Zheng
Clovis I, France, King of the Franks, 0481-01-01, 0511-11-27, Merovingian, Royal court, —
Childebert I, France, King of Paris, 0511-11-27, 0558-12-23, Merovingian, Royal court, —
Clotaire I, France, King of the Franks, 0558-12-23, 0561-11-29, Merovingian, Royal court, —
Dagobert I, France, King of the Franks, 0629-01-01, 0639-01-19, Merovingian, Royal court, —
Pepin the Short, France, King of the Franks, 0751-11-01, 0768-09-24, Carolingian, Royal court, —
Charlemagne, France, King of the Franks, 0768-09-24, 0814-01-28, Carolingian, Royal court, —
Louis the Pious, France, King of the Franks, 0814-01-28, 0840-06-20, Carolingian, Royal court, —
Charles the Bald, France, King of West Francia, 0843-08-10, 0877-10-06, Carolingian, Royal court, —
Hugh Capet, France, King of France, 0987-07-03, 0996-10-24, Capetian, Royal court, —
Robert II of France, France, King of France, 0996-10-24, 1031-07-20, Capetian, Royal court, —
Philip II of France, France, King of France, 1180-09-18, 1223-07-14, Capetian, Royal court, —
Louis IX of France, France, King of France, 1226-11-08, 1270-08-25, Capetian, Royal court, —
Philip IV of France, France, King of France, 1285-10-05, 1314-11-29, Capetian, Royal court, —
Philip VI of France, France, King of France, 1328-04-01, 1350-08-22, Valois, Royal court, —
Charles V of France, France, King of France, 1364-04-08, 1380-09-16, Valois, Royal court, —
Charles VII of France, France, King of France, 1422-10-21, 1461-07-22, Valois, Royal court, —
Louis XI of France, France, King of France, 1461-07-22, 1483-08-30, Valois, Royal court, —
Francis I of France, France, King of France, 1515-01-01, 1547-03-31, Valois, Royal court, —
Henry II of France, France, King of France, 1547-03-31, 1559-07-10, Valois, Royal court, —
Henry IV of France, France, King of France, 1589-08-02, 1610-05-14, Bourbon, Royal court, —
Louis XIII of France, France, King of France, 1610-05-14, 1643-05-14, Bourbon, Royal court, —
Louis XIV of France, France, King of France, 1643-05-14, 1715-09-01, Bourbon, Royal court, —
Louis XV of France, France, King of France, 1715-09-01, 1774-05-10, Bourbon, Royal court, —
Louis XVI of France, France, King of France, 1774-05-10, 1792-09-21, Bourbon, Royal court, —
Louis XVIII of France, France, King of France, 1814-04-06, 1824-09-16, Bourbon, Royal court, —
Charles X of France, France, King of France, 1824-09-16, 1830-08-02, Bourbon, Royal court, —
Louis Philippe I, France, King of the French, 1830-08-09, 1848-02-24, Orléans, Royal court, —
Louis-Napoléon Bonaparte, France, President, 1848-12-20, 1852-12-02, Bonapartist, National Assembly, —
Adolphe Thiers, France, President, 1871-08-31, 1873-05-24, Republican, National Assembly, —
Patrice de MacMahon, France, President, 1873-05-24, 1879-01-30, Monarchist, National Assembly, —
Jules Grévy, France, President, 1879-01-30, 1887-12-02, Republican, National Assembly, —
Sadi Carnot, France, President, 1887-12-03, 1894-06-25, Republican, National Assembly, —
Jean Casimir-Perier, France, President, 1894-06-27, 1895-01-16, Republican, National Assembly, —
Félix Faure, France, President, 1895-01-17, 1899-02-16, Republican, National Assembly, —
Émile Loubet, France, President, 1899-02-18, 1906-02-18, Republican, National Assembly, —
Armand Fallières, France, President, 1906-02-18, 1913-02-18, Republican, National Assembly, —
Raymond Poincaré, France, President, 1913-02-18, 1920-02-18, Republican, National Assembly, —
Paul Deschanel, France, President, 1920-02-18, 1920-09-21, Republican, National Assembly, —
Alexandre Millerand, France, President, 1920-09-23, 1924-06-11, Republican, National Assembly, —
Gaston Doumergue, France, President, 1924-06-13, 1931-06-13, Radical, National Assembly, —
Paul Doumer, France, President, 1931-06-13, 1932-05-07, Radical, National Assembly, —
Albert Lebrun, France, President, 1932-05-10, 1940-07-11, Democratic Republican Alliance, National Assembly, —
Vincent Auriol, France, President, 1947-01-16, 1954-01-16, SFIO (Socialist), National Assembly, —
René Coty, France, President, 1954-01-16, 1959-01-08, Independent Republican, National Assembly, —
Charles de Gaulle, France, President, 1959-01-08, 1969-04-28, Gaullist, Parliament, —
Alain Poher, France, Acting President, 1969-04-28, 1969-06-20, Centrist, Parliament, —
Georges Pompidou, France, President, 1969-06-20, 1974-04-02, Gaullist, Parliament, —
Alain Poher, France, Acting President, 1974-04-02, 1974-05-27, Centrist, Parliament, —
Valéry Giscard d’Estaing, France, President, 1974-05-27, 1981-05-21, Independent Republican, Parliament, —
François Mitterrand, France, President, 1981-05-21, 1995-05-17, Socialist, Parliament, —
Jacques Chirac, France, President, 1995-05-17, 2007-05-16, Gaullist (RPR/UMP), Parliament, —
Nicolas Sarkozy, France, President, 2007-05-16, 2012-05-15, UMP, Parliament, —
François Hollande, France, President, 2012-05-15, 2017-05-14, Socialist, Parliament, —
Emmanuel Macron, France, President, 2017-05-14, Present, Renaissance, Parliament, —
Pedro I, Brazil, Emperor, 1822-10-12, 1831-04-07, —, General Assembly, —
Pedro II, Brazil, Emperor, 1831-04-07, 1889-11-15, —, General Assembly, —
Deodoro da Fonseca, Brazil, President, 1889-11-15, 1891-11-23, Military / Republican, National Congress, Floriano Peixoto
Floriano Peixoto, Brazil, President, 1891-11-23, 1894-11-15, Republican, National Congress, —
Prudente de Morais, Brazil, President, 1894-11-15, 1898-11-15, Republican, National Congress, Manuel Vitorino
Campos Sales, Brazil, President, 1898-11-15, 1902-11-15, Republican, National Congress, Rosa e Silva
Rodrigues Alves, Brazil, President, 1902-11-15, 1906-11-15, Republican, National Congress, Afonso Pena
Afonso Pena, Brazil, President, 1906-11-15, 1909-06-14, Republican, National Congress, Nilo Peçanha
Nilo Peçanha, Brazil, President, 1909-06-14, 1910-11-15, Republican, National Congress, —
Hermes da Fonseca, Brazil, President, 1910-11-15, 1914-11-15, Republican, National Congress, Venceslau Brás
Venceslau Brás, Brazil, President, 1914-11-15, 1918-11-15, Republican, National Congress, Urbano Santos
Delfim Moreira, Brazil, President (acting), 1918-11-15, 1919-07-28, Republican, National Congress, —
Epitácio Pessoa, Brazil, President, 1919-07-28, 1922-11-15, Republican, National Congress, Bueno de Paiva
Artur Bernardes, Brazil, President, 1922-11-15, 1926-11-15, Republican, National Congress, Estácio Coimbra
Washington Luís, Brazil, President, 1926-11-15, 1930-10-24, Republican, National Congress, Fernando de Melo Viana
Getúlio Vargas, Brazil, President, 1930-11-03, 1945-10-29, —, —, —
José Linhares, Brazil, President (acting), 1945-10-29, 1946-01-31, —, National Congress, —
Eurico Gaspar Dutra, Brazil, President, 1946-01-31, 1951-01-31, PSD, National Congress, Nereu Ramos
Getúlio Vargas, Brazil, President, 1951-01-31, 1954-08-24, PTB, National Congress, Café Filho
Café Filho, Brazil, President, 1954-08-24, 1955-11-08, PTB, National Congress, —
Carlos Luz, Brazil, President (acting), 1955-11-08, 1955-11-11, PSD, National Congress, —
Nereu Ramos, Brazil, President (acting), 1955-11-11, 1956-01-31, PSD, National Congress, —
Juscelino Kubitschek, Brazil, President, 1956-01-31, 1961-01-31, PSD, National Congress, João Goulart
Jânio Quadros, Brazil, President, 1961-01-31, 1961-08-25, PTN, National Congress, João Goulart
Ranieri Mazzilli, Brazil, President (acting), 1961-08-25, 1961-09-07, PSD, National Congress, —
João Goulart, Brazil, President, 1961-09-07, 1964-04-02, PTB, National Congress, —
Ranieri Mazzilli, Brazil, President (acting), 1964-04-02, 1964-04-15, PSD, National Congress, —
Humberto Castelo Branco, Brazil, President, 1964-04-15, 1967-03-15, ARENA, National Congress, José Maria Alkmin
Artur da Costa e Silva, Brazil, President, 1967-03-15, 1969-08-31, ARENA, National Congress, Pedro Aleixo
Military Junta, Brazil, Acting presidency, 1969-08-31, 1969-10-30, Military, —, —
Emílio Garrastazu Médici, Brazil, President, 1969-10-30, 1974-03-15, ARENA, National Congress, Adalberto Pereira
Ernesto Geisel, Brazil, President, 1974-03-15, 1979-03-15, ARENA, National Congress, Adalberto Pereira
João Figueiredo, Brazil, President, 1979-03-15, 1985-03-15, PDS, National Congress, Aureliano Chaves
Tancredo Neves, Brazil, President-elect, 1985-03-15, 1985-04-21, PMDB, National Congress, José Sarney
José Sarney, Brazil, President, 1985-03-15, 1990-03-15, PMDB, National Congress, —
Fernando Collor, Brazil, President, 1990-03-15, 1992-12-29, PRN, National Congress, Itamar Franco
Itamar Franco, Brazil, President, 1992-12-29, 1995-01-01, PMDB, National Congress, —
Fernando Henrique Cardoso, Brazil, President, 1995/01/01, 2003/01/01, PSDB, National Congress, Marco Maciel
Luiz Inácio Lula da Silva, Brazil, President, 2003-01-01, 2011-01-01, PT, National Congress, José Alencar
Dilma Rousseff, Brazil, President, 2011-01-01, 2016-08-31, PT, National Congress, Michel Temer
Michel Temer, Brazil, President, 2016-08-31, 2019-01-01, PMDB, National Congress, —
Jair Bolsonaro, Brazil, President, 2019-01-01, 2023-01-01, PSL - PL, National Congress, Hamilton Mourão
Luiz Inácio Lula da Silva, Brazil, President, 2023-01-01, Present, PT, National Congress, Geraldo Alckmin
Leopold III, Austrian Empire, Margrave of Austria, 1095, 1136, , , 
Henry II Jasomirgott, Austrian Empire, Duke of Austria, 1156, 1177, , , 
Leopold V, Austrian Empire, Duke of Austria, 1177, 1194, , , 
Frederick II the Quarrelsome, Austrian Empire, Duke of Austria, 1230, 1246, , , 
Rudolf I, Austrian Empire, Duke of Austria, 1278, 1282, , , 
Albert II, Austrian Empire, Archduke of Austria, 1404, 1439, , , 
Frederick III, Austrian Empire, Archduke of Austria, 1457, 1493, , , 
Maximilian I, Austrian Empire, Archduke of Austria, 1493, 1519, , , 
Francis I, Austrian Empire, Emperor of Austria, 1804, 1835, , Imperial Council, 
Ferdinand I, Austrian Empire, Emperor of Austria, 1835, 1848, , Imperial Council, 
Franz Joseph I, Austrian Empire, Emperor of Austria, 1848, 1867, , Imperial Council, 
Franz Joseph I, Austria-Hungary Empire, Emperor of Austria, 1867, 1916, , Reichsrat, 
Charles I, Austria-Hungary Empire, Emperor of Austria, 1916, 1918, , Reichsrat, 
Karl Seitz, Autria, President (Provisional), 1919, 1920, SDAPÖ, Constituent Assembly, 
Michael Hainisch, Autria, Federal President, 1920, 1928, Independent, Federal Assembly, 
Wilhelm Miklas, Autria, Federal President, 1928, 1938, Christian Social Party, Federal Assembly, 
Karl Renner, Autria, Federal President, 1945, 1950, SPÖ, Federal Assembly, 
Theodor Körner, Autria, Federal President, 1951, 1957, SPÖ, Federal Assembly, 
Adolf Schärf, Autria, Federal President, 1957, 1965, SPÖ, Federal Assembly, 
Franz Jonas, Autria, Federal President, 1965, 1974, SPÖ, Federal Assembly, 
Rudolf Kirchschläger, Autria, Federal President, 1974, 1986, Independent, Federal Assembly, 
Kurt Waldheim, Autria, Federal President, 1986, 1992, Independent, Federal Assembly, 
Thomas Klestil, Autria, Federal President, 1992, 2004, ÖVP, Federal Assembly, 
Heinz Fischer, Autria, Federal President, 2004, 2016, SPÖ, Federal Assembly, 
Alexander Van der Bellen, Autria, Federal President, 2017, Incumbent, Independent (Greens-backed), Federal Assembly, 
Muhammad Naguib, Republic of Egypt, President, 1953-06-18, 1954-11-14, Military, , 
Gamal Abdel Nasser, Republic of Egypt, President, 1954-11-14, 1956-06-23, Arab Socialist Union, , Zakaria Mohieddin
Gamal Abdel Nasser, Republic of Egypt, President, 1956-06-23, 1958-02-22, , , 
Gamal Abdel Nasser, United Arab Republic, President, 1958-02-22, 1965-03-15, , , 
Gamal Abdel Nasser, United Arab Republic, President, 1965-03-15, 1970-09-28, , , 
Anwar Sadat, United Arab Republic, President, 1970-09-28, 1970-10-15, , , 
Anwar Sadat, United Arab Republic, President, 1970-10-15, 1971-09-11, National Democratic Party, , Hosni Mubarak
Anwar Sadat, Arab Republic of Egypt, President, 1971-09-11, 1981-10-06, , , 
Sufi Abu Taleb, Arab Republic of Egypt, President, 1981-10-06, 1981-10-14, , , 
Hosni Mubarak, Arab Republic of Egypt, President, 1981-10-14, 2011-02-11, National Democratic Party, , Omar Suleiman
Muhammad Hussein Tantawy, Arab Republic of Egypt, President, 2011-02-11, 2012-06-30, , , 
Mohamed Morsi, Arab Republic of Egypt, President, 2012-06-30, 2013-07-03, Freedom and Justice Party, , Mahmoud Mekki
Adly Mansour, Arab Republic of Egypt, President, 2013-07-03, 2014-06-08, Independent, , 
Abdel Fattah el-Sisi, Arab Republic of Egypt, President, 2014-06-08, Incumbent, Independent, , —
Jimmu, Japan, Emperor, 660 BCE, 585 BCE, —, —, —
Suizei, Japan, Emperor, 581 BCE, 549 BCE, —, —, —
Annei, Japan, Emperor, 549 BCE, 511 BCE, —, —, —
Itoku, Japan, Emperor, 510 BCE, 477 BCE, —, —, —
Kōshō, Japan, Emperor, 475 BCE, 393 BCE, —, —, —
Kōan, Japan, Emperor, 392 BCE, 291 BCE, —, —, —
Kōrei, Japan, Emperor, 290 BCE, 215 BCE, —, —, —
Kōgen, Japan, Emperor, 214 BCE, 158 BCE, —, —, —
Kaika, Japan, Emperor, 157 BCE, 98 BCE, —, —, —
Sujin, Japan, Emperor, 97 BCE, 30 BCE, —, —, —
Suinin, Japan, Emperor, 29 BCE, 70 CE, —, —, —
Keikō, Japan, Emperor, 71, 130, —, —, —
Seimu, Japan, Emperor, 131, 190, —, —, —
Chūai, Japan, Emperor, 192, 200, —, —, —
Ōjin, Japan, Emperor, 270, 310, —, —, —
Nintoku, Japan, Emperor, 313, 399, —, —, —
Richū, Japan, Emperor, 400, 405, —, —, —
Hanzei, Japan, Emperor, 406, 410, —, —, —
Ingyō, Japan, Emperor, 412, 453, —, —, —
Ankō, Japan, Emperor, 453, 456, —, —, —
Yūryaku, Japan, Emperor, 456, 479, —, —, —
Seinei, Japan, Emperor, 480, 484, —, —, —
Kenzō, Japan, Emperor, 485, 487, —, —, —
Ninken, Japan, Emperor, 488, 498, —, —, —
Buretsu, Japan, Emperor, 498, 507, —, —, —
Keitai, Japan, Emperor, 507, 531, —, —, —
Ankan, Japan, Emperor, 531, 536, —, —, —
Senka, Japan, Emperor, 536, 539, —, —, —
Kinmei, Japan, Emperor, 539, 571, —, —, —
Bidatsu, Japan, Emperor, 572, 585, —, —, —
Yōmei, Japan, Emperor, 585, 587, —, —, —
Sushun, Japan, Emperor, 587, 592, —, —, —
Suiko, Japan, Emperor, 592, 628, —, —, —
Jomei, Japan, Emperor, 629, 641, —, —, —
Kōgyoku / Saimei, Japan, Emperor, 642, 661, —, —, —
Tenji, Japan, Emperor, 661, 672, —, —, —
Kōbun, Japan, Emperor, 672, 672, —, —, —
Tenmu, Japan, Emperor, 673, 686, —, —, —
Jitō, Japan, Emperor, 686, 697, —, —, —
Monmu, Japan, Emperor, 697, 707, —, —, —
Genmei, Japan, Emperor, 707, 715, —, —, —
Genshō, Japan, Emperor, 715, 724, —, —, —
Shōmu, Japan, Emperor, 724, 749, —, —, —
Kōken / Shōtoku, Japan, Emperor, 749, 770, —, —, —
Kōnin, Japan, Emperor, 770, 781, —, —, —
Kanmu, Japan, Emperor, 781, 806, —, —, —
Heizei, Japan, Emperor, 806, 809, —, —, —
Saga, Japan, Emperor, 809, 823, —, —, —
Junna, Japan, Emperor, 823, 833, —, —, —
Ninmyō, Japan, Emperor, 833, 850, —, —, —
Montoku, Japan, Emperor, 850, 858, —, —, —
Seiwa, Japan, Emperor, 858, 876, —, —, —
Yōzei, Japan, Emperor, 876, 884, —, —, —
Kōkō, Japan, Emperor, 884, 887, —, —, —
Uda, Japan, Emperor, 887, 897, —, —, —
Daigo, Japan, Emperor, 897, 930, —, —, —
Suzaku, Japan, Emperor, 930, 946, —, —, —
Murakami, Japan, Emperor, 946, 967, —, —, —
Reizei, Japan, Emperor, 967, 969, —, —, —
En'yū, Japan, Emperor, 969, 984, —, —, —
Kazan, Japan, Emperor, 984, 986, —, —, —
Ichijō, Japan, Emperor, 986, 1011, —, —, —
Sanjō, Japan, Emperor, 1011, 1016, —, —, —
Go-Ichijō, Japan, Emperor, 1016, 1036, —, —, —
Go-Suzaku, Japan, Emperor, 1036, 1045, —, —, —
Go-Reizei, Japan, Emperor, 1045, 1068, —, —, —
Go-Sanjō, Japan, Emperor, 1068, 1073, —, —, —
Shirakawa, Japan, Emperor, 1073, 1087, —, —, —
Horikawa, Japan, Emperor, 1087, 1107, —, —, —
Toba, Japan, Emperor, 1107, 1123, —, —, —
Sutoku, Japan, Emperor, 1123, 1142, —, —, —
Konoe, Japan, Emperor, 1142, 1155, —, —, —
