Carlos Ibáñez del Campo, Chile, President, 1927-07-21, 1931-07-26, Independent, National Congress, —
Juan Esteban Montero, Chile, President, 1931-11-15, 1932-06-04, Radical, National Congress, —
Arturo Alessandri, Chile, President, 1932-12-24, 1938-12-24, Liberal, National Congress, —
Pedro Aguirre Cerda, Chile, President, 1938-12-24, 1941-11-25, Radical, National Congress, —
Juan Antonio Ríos, Chile, President, 1942-04-02, 1946-01-27, Radical, National Congress, —
Gabriel González Videla, Chile, President, 1946-11-03, 1952-11-03, Radical, National Congress, —
Carlos Ibáñez del Campo, Chile, President, 1952-11-03, 1958-11-03, Independent, National Congress, —
Jorge Alessandri, Chile, President, 1958-11-03, 1964-11-03, Independent, National Congress, —
Eduardo Frei Montalva, Chile, President, 1964-11-03, 1970-11-03, Christian Democrat, National Congress, —
Salvador Allende, Chile, President, 1970-11-03, 1973-09-11, Socialist, National Congress, —
Augusto Pinochet, Chile, President, 1974-12-17, 1990-03-11, Military / Independent, Junta / Legislature, —
Patricio Aylwin, Chile, President, 1990-03-11, 1994-03-11, Christian Democrat, National Congress, —
Eduardo Frei Ruiz-Tagle, Chile, President, 1994-03-11, 2000-03-11, Christian Democrat, National Congress, —
Ricardo Lagos, Chile, President, 2000-03-11, 2006-03-11, Socialist, National Congress, —
Michelle Bachelet, Chile, President, 2006-03-11, 11/03/2010, Socialist, National Congress, —
Sebastián Piñera, Chile, President, 11/03/2010, 11/03/2014, National Renewal, National Congress, —
Michelle Bachelet, Chile, President, 11/03/2014, 11/03/2018, Socialist, National Congress, —
Sebastián Piñera, Chile, President, 11/03/2018, 2022-03-11, National Renewal, National Congress, —
Gabriel Boric, Chile, President, 2022-03-11, Present, Social Convergence, National Congress, —
Jomo Kenyatta, Kenya, President, 1964-12-12, 1978-08-22, Kenya African National Union (KANU), National Assembly, Jaramogi Oginga Odinga; Joseph Murumbi; Daniel arap Moi
Daniel arap Moi, Kenya, President, 1978-08-22, 2002-12-30, Kenya African National Union (KANU), National Assembly, Mwai Kibaki; Josephat Karanja; George Saitoti; Musalia Mudavadi
Mwai Kibaki, Kenya, President, 2002-12-30, 2013-04-09, National Rainbow Coalition / Party of National Unity, National Assembly / Parliament, Michael Wamalwa Kijana; Moody Awori; Kalonzo Musyoka
Uhuru Kenyatta, Kenya, President, 2013-04-09, 2022-09-13, The National Alliance / Jubilee Party, Parliament, William Ruto
William Ruto, Kenya, President, 2022-09-13, Present, United Democratic Alliance, Parliament, Rigathi Gachagua
Syngman Rhee, South Korea, President, 1948-07-24, 1960-04-26, Liberal Party, National Assembly, Yi Si-yeong; Ham Tae-young; Chang Myon
Yun Bo-seon, South Korea, President, 1960-08-13, 1962-03-22, Democratic Party, National Assembly, Chang Myon
Park Chung-hee, South Korea, President, 1963-12-17, 1979-10-26, Democratic Republican Party, National Assembly, Various (no fixed vice presidency after 1963)
Choi Kyu-hah, South Korea, President, 1979-12-06, 1980-08-16, Independent, National Assembly, —
Chun Doo-hwan, South Korea, President, 1980-09-01, 1988-02-25, Democratic Justice Party, National Assembly, —
Roh Tae-woo, South Korea, President, 1988-02-25, 1993-02-25, Democratic Justice Party, National Assembly, —
Kim Young-sam, South Korea, President, 1993-02-25, 1998-02-25, Democratic Liberal Party, National Assembly, —
Kim Dae-jung, South Korea, President, 1998-02-25, 2003-02-25, National Congress for New Politics, National Assembly, —
Roh Moo-hyun, South Korea, President, 2003-02-25, 2008-02-25, Uri Party, National Assembly, —
Lee Myung-bak, South Korea, President, 2008-02-25, 2013-02-25, Grand National Party, National Assembly, —
Park Geun-hye, South Korea, President, 2013-02-25, 2017-03-10, Saenuri Party, National Assembly, —
Hwang Kyo-ahn, South Korea, Acting President, 2017-03-10, 2017-05-10, Independent, National Assembly, —
Moon Jae-in, South Korea, President, 2017-05-10, 2022-05-10, Democratic Party, National Assembly, —
Yoon Suk Yeol, South Korea, President, 2022-05-10, Present, People Power Party, National Assembly, —
Kim Il-sung, North Korea, Premier / President, 1948-09-09, 1994-07-08, Workers’ Party of Korea, Supreme People’s Assembly, —
Kim Jong-il, North Korea, Supreme Leader / Chairman NDC, 1994-07-08, 2011-12-17, Workers’ Party of Korea, Supreme People’s Assembly, —
Kim Jong-un, North Korea, Supreme Leader / President SAC, 2011-12-17, Present, Workers’ Party of Korea, Supreme People’s Assembly, Choe Ryong-hae (SPA Presidium)
